Bluetooth: btusb: Add Qualcomm Bluetooth SoC WCN6855 support

jira LE-1907
Rebuild_History Non-Buildable kernel-4.18.0-310.el8
commit-author Rocky Liao <rjliao@codeaurora.org>
commit b40f58b973865ee98ead884d2bdc7880b896ddb8
Empty-Commit: Cherry-Pick Conflicts during history rebuild.
Will be included in final tarball splat. Ref for failed cherry-pick at:
ciq/ciq_backports/kernel-4.18.0-310.el8/b40f58b9.failed

This patch add support for WCN6855 i.e. patch and nvm download
support.

T:  Bus=01 Lev=01 Prnt=01 Port=00 Cnt=01 Dev#=  2 Spd=12   MxCh= 0
D:  Ver= 1.10 Cls=e0(wlcon) Sub=01 Prot=01 MxPS=64 #Cfgs=  1
P:  Vendor=0cf3 ProdID=e600 Rev= 0.01
C:* #Ifs= 2 Cfg#= 1 Atr=e0 MxPwr=100mA
I:* If#= 0 Alt= 0 #EPs= 3 Cls=e0(wlcon) Sub=01 Prot=01 Driver=btusb
E:  Ad=81(I) Atr=03(Int.) MxPS=  16 Ivl=1ms
E:  Ad=82(I) Atr=02(Bulk) MxPS=  64 Ivl=0ms
E:  Ad=02(O) Atr=02(Bulk) MxPS=  64 Ivl=0ms
I:* If#= 1 Alt= 0 #EPs= 2 Cls=e0(wlcon) Sub=01 Prot=01 Driver=btusb
E:  Ad=83(I) Atr=01(Isoc) MxPS=   0 Ivl=1ms
E:  Ad=03(O) Atr=01(Isoc) MxPS=   0 Ivl=1ms
I:  If#= 1 Alt= 1 #EPs= 2 Cls=e0(wlcon) Sub=01 Prot=01 Driver=btusb
E:  Ad=83(I) Atr=01(Isoc) MxPS=   9 Ivl=1ms
E:  Ad=03(O) Atr=01(Isoc) MxPS=   9 Ivl=1ms
I:  If#= 1 Alt= 2 #EPs= 2 Cls=e0(wlcon) Sub=01 Prot=01 Driver=btusb
E:  Ad=83(I) Atr=01(Isoc) MxPS=  17 Ivl=1ms
E:  Ad=03(O) Atr=01(Isoc) MxPS=  17 Ivl=1ms
I:  If#= 1 Alt= 3 #EPs= 2 Cls=e0(wlcon) Sub=01 Prot=01 Driver=btusb
E:  Ad=83(I) Atr=01(Isoc) MxPS=  25 Ivl=1ms
E:  Ad=03(O) Atr=01(Isoc) MxPS=  25 Ivl=1ms
I:  If#= 1 Alt= 4 #EPs= 2 Cls=e0(wlcon) Sub=01 Prot=01 Driver=btusb
E:  Ad=83(I) Atr=01(Isoc) MxPS=  33 Ivl=1ms
E:  Ad=03(O) Atr=01(Isoc) MxPS=  33 Ivl=1ms
I:  If#= 1 Alt= 5 #EPs= 2 Cls=e0(wlcon) Sub=01 Prot=01 Driver=btusb
E:  Ad=83(I) Atr=01(Isoc) MxPS=  49 Ivl=1ms
E:  Ad=03(O) Atr=01(Isoc) MxPS=  49 Ivl=1ms
I:  If#= 1 Alt= 6 #EPs= 2 Cls=e0(wlcon) Sub=01 Prot=01 Driver=btusb
E:  Ad=83(I) Atr=01(Isoc) MxPS=  63 Ivl=1ms
E:  Ad=03(O) Atr=01(Isoc) MxPS=  63 Ivl=1ms
I:  If#= 1 Alt= 7 #EPs= 2 Cls=e0(wlcon) Sub=01 Prot=01 Driver=btusb
E:  Ad=83(I) Atr=01(Isoc) MxPS=  65 Ivl=1ms
E:  Ad=03(O) Atr=01(Isoc) MxPS=  65 Ivl=1ms

	Signed-off-by: Rocky Liao <rjliao@codeaurora.org>
	Signed-off-by: Marcel Holtmann <marcel@holtmann.org>
(cherry picked from commit b40f58b973865ee98ead884d2bdc7880b896ddb8)
	Signed-off-by: Jonathan Maple <jmaple@ciq.com>

# Conflicts:
#	drivers/bluetooth/btusb.c
diff --cc drivers/bluetooth/btusb.c
index af929a6be759,1005b6e8ff74..000000000000
--- a/drivers/bluetooth/btusb.c
+++ b/drivers/bluetooth/btusb.c
@@@ -73,7 -58,8 +73,12 @@@ static struct usb_driver btusb_driver
  #define BTUSB_CW6622		0x100000
  #define BTUSB_MEDIATEK		0x200000
  #define BTUSB_WIDEBAND_SPEECH	0x400000
++<<<<<<< HEAD
 +#define BTUSB_INTEL_NEWGEN	0x2000000
++=======
+ #define BTUSB_VALID_LE_STATES   0x800000
+ #define BTUSB_QCA_WCN6855	0x1000000
++>>>>>>> b40f58b97386 (Bluetooth: btusb: Add Qualcomm Bluetooth SoC WCN6855 support)
  
  static const struct usb_device_id btusb_table[] = {
  	/* Generic Bluetooth USB device */
* Unmerged path drivers/bluetooth/btusb.c
