Bluetooth: btusb: Add support for IMC Networks Mediatek Chip(MT7921)

jira LE-1907
Rebuild_History Non-Buildable kernel-4.18.0-530.el8
commit-author mark-yw.chen <mark-yw.chen@mediatek.com>
commit 15957cab9db009c10925994b59a64410a707c17e
Empty-Commit: Cherry-Pick Conflicts during history rebuild.
Will be included in final tarball splat. Ref for failed cherry-pick at:
ciq/ciq_backports/kernel-4.18.0-530.el8/15957cab.failed

Add support for another IMC Networks Mediatek Chip(MT7921)

* /sys/kernel/debug/usb/devices
T:  Bus=05 Lev=01 Prnt=01 Port=00 Cnt=01 Dev#=  2 Spd=480  MxCh= 0
D:  Ver= 2.10 Cls=ef(misc ) Sub=02 Prot=01 MxPS=64 #Cfgs=  1
P:  Vendor=13d3 ProdID=3564 Rev= 1.00
S:  Manufacturer=MediaTek Inc.
S:  Product=Wireless_Device
S:  SerialNumber=000000000
C:* #Ifs= 3 Cfg#= 1 Atr=e0 MxPwr=100mA
A:  FirstIf#= 0 IfCount= 3 Cls=e0(wlcon) Sub=01 Prot=01
I:* If#= 0 Alt= 0 #EPs= 3 Cls=e0(wlcon) Sub=01 Prot=01 Driver=btusb
E:  Ad=81(I) Atr=03(Int.) MxPS=  16 Ivl=125us
E:  Ad=82(I) Atr=02(Bulk) MxPS= 512 Ivl=0ms
E:  Ad=02(O) Atr=02(Bulk) MxPS= 512 Ivl=0ms
I:* If#= 1 Alt= 0 #EPs= 2 Cls=e0(wlcon) Sub=01 Prot=01 Driver=btusb
E:  Ad=83(I) Atr=01(Isoc) MxPS=   0 Ivl=1ms
E:  Ad=03(O) Atr=01(Isoc) MxPS=   0 Ivl=1ms
I:  If#= 1 Alt= 1 #EPs= 2 Cls=e0(wlcon) Sub=01 Prot=01 Driver=btusb
E:  Ad=83(I) Atr=01(Isoc) MxPS=   9 Ivl=1ms
E:  Ad=03(O) Atr=01(Isoc) MxPS=   9 Ivl=1ms
I:  If#= 1 Alt= 2 #EPs= 2 Cls=e0(wlcon) Sub=01 Prot=01 Driver=btusb
E:  Ad=83(I) Atr=01(Isoc) MxPS=  17 Ivl=1ms
E:  Ad=03(O) Atr=01(Isoc) MxPS=  17 Ivl=1ms
I:  If#= 1 Alt= 3 #EPs= 2 Cls=e0(wlcon) Sub=01 Prot=01 Driver=btusb
E:  Ad=83(I) Atr=01(Isoc) MxPS=  25 Ivl=1ms
E:  Ad=03(O) Atr=01(Isoc) MxPS=  25 Ivl=1ms
I:  If#= 1 Alt= 4 #EPs= 2 Cls=e0(wlcon) Sub=01 Prot=01 Driver=btusb
E:  Ad=83(I) Atr=01(Isoc) MxPS=  33 Ivl=1ms
E:  Ad=03(O) Atr=01(Isoc) MxPS=  33 Ivl=1ms
I:  If#= 1 Alt= 5 #EPs= 2 Cls=e0(wlcon) Sub=01 Prot=01 Driver=btusb
E:  Ad=83(I) Atr=01(Isoc) MxPS=  49 Ivl=1ms
E:  Ad=03(O) Atr=01(Isoc) MxPS=  49 Ivl=1ms
I:  If#= 1 Alt= 6 #EPs= 2 Cls=e0(wlcon) Sub=01 Prot=01 Driver=btusb
E:  Ad=83(I) Atr=01(Isoc) MxPS=  63 Ivl=1ms
E:  Ad=03(O) Atr=01(Isoc) MxPS=  63 Ivl=1ms
I:* If#= 2 Alt= 0 #EPs= 2 Cls=e0(wlcon) Sub=01 Prot=01 Driver=(none)
E:  Ad=8a(I) Atr=03(Int.) MxPS=  64 Ivl=125us
E:  Ad=0a(O) Atr=03(Int.) MxPS=  64 Ivl=125us
I:  If#= 2 Alt= 1 #EPs= 2 Cls=e0(wlcon) Sub=01 Prot=01 Driver=(none)
E:  Ad=8a(I) Atr=03(Int.) MxPS=  64 Ivl=125us
E:  Ad=0a(O) Atr=03(Int.) MxPS=  64 Ivl=125us

	Signed-off-by: mark-yw.chen <mark-yw.chen@mediatek.com>
	Signed-off-by: Marcel Holtmann <marcel@holtmann.org>
(cherry picked from commit 15957cab9db009c10925994b59a64410a707c17e)
	Signed-off-by: Jonathan Maple <jmaple@ciq.com>

# Conflicts:
#	drivers/bluetooth/btusb.c
diff --cc drivers/bluetooth/btusb.c
index 77d37b886bb4,8ef4e0f6e0bb..000000000000
--- a/drivers/bluetooth/btusb.c
+++ b/drivers/bluetooth/btusb.c
@@@ -453,7 -412,7 +453,11 @@@ static const struct usb_device_id black
  	{ USB_DEVICE(0x13d3, 0x3563), .driver_info = BTUSB_MEDIATEK |
  						     BTUSB_WIDEBAND_SPEECH |
  						     BTUSB_VALID_LE_STATES },
++<<<<<<< HEAD
 +	{ USB_DEVICE(0x13d3, 0x3567), .driver_info = BTUSB_MEDIATEK |
++=======
+ 	{ USB_DEVICE(0x13d3, 0x3564), .driver_info = BTUSB_MEDIATEK |
++>>>>>>> 15957cab9db0 (Bluetooth: btusb: Add support for IMC Networks Mediatek Chip(MT7921))
  						     BTUSB_WIDEBAND_SPEECH |
  						     BTUSB_VALID_LE_STATES },
  	{ USB_DEVICE(0x0489, 0xe0cd), .driver_info = BTUSB_MEDIATEK |
* Unmerged path drivers/bluetooth/btusb.c
